{
 "refId": "valve-construction",
 "version": "1.11.0",
 "source": "Standard titles and scope statements. API 594-2022, 599-2025, 600-2021, 602-2015, 603-2025, 608-2020, 609-2021, 623-2021, API Spec 6D-2021 and ISO 15761-2020 are HELD and verified against purchased copies; the three BS entries are still unchecked claims.",
 "note": "How a manual valve is BUILT, as distinct from how it is DIMENSIONED. A PMS valve line normally carries both: 'API 600' (construction) and 'ASME B16.10' (face to face). This pack answers one question the body row cannot - is this construction standard the right one for this valve type at this size. It deliberately does NOT carry trim (materials.ref.json group VALVE_TRIM) or operators (actuators.ref.json, manual half), because both already exist and a second copy would be a second answer.",
 "conventions": {
  "scopeIsAClaim": "npsMin / npsMax come from the scope clause on the front page of each standard, read from the title and industry usage rather than from the standard itself. That is exactly the situation the allowable-stress round created the verified flag for: the value is held, it is reported, and no finding built on it may be presented as a standard's requirement until someone has the document in hand.",
  "valveTypesAreTheTemplateQualifiers": "Every code in valveTypes must be a qualifier the VALVE component template offers. This pack does not get to invent valve types the rest of the platform has never heard of - the same rule the trim group and the actuator pack are held to.",
  "bodyGroupsAreProductForms": "bodyGroups names material-library GROUPS, which are product forms, not metallurgy. API 600 is a cast bolted-bonnet valve and API 602 is its forged small-bore counterpart; that difference is the clearest reason the two standards exist, so it is recorded. Null means the standard does not turn on it.",
  "severalStandardsMayCoverOneType": "A gate valve may legitimately be built to API 600, API 603, API 6D, BS 1414 or ISO 15761 depending on service and size. This pack narrows a dropdown and catches a contradiction; it never picks.",
  "sourceQualityMatters": "Owning a standard is not the same as being able to read it. API 600-2021 arrived as a 109 dpi SCAN with no text layer: its prose OCRs cleanly and its numeric tables do not. So an entry carries sourceQuality as well as verified - TEXT means the figures can be transcribed, SCANNED_IMAGE means the prose can be trusted and the tables cannot. A wall thickness read off a bad scan is worse than no wall thickness.",
  "aVerifiedEntryRecordsWhatItCorrected": "When a guess turns out wrong the old value is kept in correctedFromGuess. That is the whole return on the verified:false discipline: it shows which findings the platform was raising wrongly, and for how long.",
  "bodyGroupsIsNotAlwaysTheRightQuestion": "bodyGroups asks which PRODUCT FORM a standard permits - cast, forged. Three standards have now been read and none of them turns on that: API 600, 602 and 603 all say \"cast or forged\". API 603 restricts something else entirely - Table 4 gives the body as \"As selected from ASME B16.34, Group 2 and Group 3\", which is a MATERIAL GROUP constraint and a far sharper one. bodyMaterialGroups carries it, and it resolves through valve-pt-ratings, which holds all 50 B16.34 groups.",
  "scopeCanDependOnEndType": "API 608 is the first standard here whose SIZE and CLASS depend on the END TYPE: flanged and butt-welding run NPS 1/2 to 24, socket-welding and threaded stop at NPS 2; and flanged stops at Class 600 while the other three reach Class 800. A single npsMin/npsMax/pressureClasses triple cannot say that, so endTypeScopes carries it and the flat fields hold the union for consumers that only need a rough filter.",
  "designVariantsAreNamedByTheConstructionStandard": "API 598 tests a FLOATING ball valve differently from a TRUNNION MOUNTED one and refuses to answer for a bare \"BALL\". API 608 clause 1.4 is where that vocabulary comes from: it covers \"floating (seat-supported) ball (Figure C.1) and trunnion ball valve designs (Figure C.2)\". The construction pack now supplies the two names the testing pack was asking for.",
  "notEveryValveHasAnAsmeClass": "API 609 Category A butterfly valves are rated by the MANUFACTURER at a cold working pressure, not by ASME class - clause 1.2 a). They carry a class 125 or 150 flange BOLTING PATTERN, which looks like a class and is not one. ratingBasis records the difference, because a consumer that reads a Class 150 shell rating for a Category A valve has invented a figure the standard never claimed.",
  "theFaceToFaceSourceCanDependOnTheVariant": "API 594 clause 1 splits check valves in two and gives them DIFFERENT dimension sources: a Type A valve takes its short face-to-face from API 594 Tables 2 and 3, a Type B valve takes it from ASME B16.10. The platform holds B16.10 and not API 594 Tables 2/3, so a Type A check valve would silently be given a Type B length. faceToFaceSource records which standard governs, so the gap is visible.",
  "notEveryStandardNumbersItsTrim": "API 600, 623 and 594 each print a numbered trim table. API 599 does not print one at all - a plug valve’s seat, sleeve and plug facing are agreed on the purchase order under clause 6. A \"trim number\" dropdown for plug valves offers a vocabulary the standard has not got.",
  "aSpecificationIsNotAStandard": "API 6D is a SPECIFICATION, not a standard: it covers design, manufacturing, materials, welding, quality control, assembly, testing, marking, documentation and process controls in one document, where API 600 covers a valve type. Naming it on a PMS row says less about the valve and more about the quality regime - and its Annex C face-to-face tables are NORMATIVE, so it is also a dimension source.",
  "pressureDesignationIsNotAlwaysAnAsmeClass": "ISO 15761 rates the same valve in TWO parallel systems: ASME Class 150-2500 and PN 16/25/40/63/100/250/400. The platform has no PN vocabulary at all - every pack here keys pressure on an ASME class number. Declared through pnDesignations rather than dropped, because a European PMS writes PN 40 and the platform would have nowhere to put it. Note ISO 15761’s own remark: Class 800 \"has no equivalent PN designation\", so the two systems do not even map one to one."
 },
 "standards": [
  {
   "code": "API 600",
   "title": {
    "en": "Steel Gate Valves - Flanged and Butt-welding Ends, Bolted Bonnets",
    "fa": "شیرهای کشویی فولادی با کلاهک پیچی برای صنایع نفت و گاز"
   },
   "valveTypes": [
    "GATE"
   ],
   "bodyGroups": [
    "CASTINGS",
    "FORGINGS"
   ],
   "npsMin": 1,
   "npsMax": 42,
   "note": {
    "en": "The default gate valve of the industry. Clause 1 covers DN 25 to 1050 (NPS 1 to 42) in classes 150 to 2500, with a bolted bonnet, outside screw and yoke, a rising stem and a non-rising handwheel. The body may be cast OR forged.",
    "fa": "شیر کشویی متعارف صنعت. بند ۱ سایز DN 25 تا 1050 (NPS 1 تا 42) و کلاس‌های ۱۵۰ تا ۲۵۰۰ را پوشش می‌دهد، با کلاهک پیچی، یوک بیرونی، ساقهٔ بالارونده و فلکهٔ ثابت. بدنه می‌تواند ریختگی یا فورج باشد."
   },
   "verified": true,
   "sourceQuality": "TEXT",
   "editionYear": 2021,
   "correctedFromGuess": {
    "bodyGroups": {
     "was": [
      "CASTINGS"
     ],
     "now": [
      "CASTINGS",
      "FORGINGS"
     ],
     "evidence": "Table D.1 lists the Group 1.1 body material as \"C-Si A105 or A216-WCB\" - a forging and a casting in one row - and 7.3 speaks of \"the shell of a cast or forged, carbon or alloy steel valve\". The guess would have raised BODY_FORM_AGAINST_STANDARD on every legitimate A105 forged gate valve."
    },
    "npsMin": {
     "was": 2,
     "now": 1,
     "evidence": "Clause 1 lists DN 25 upward, which is NPS 1. The guess that small bore falls to API 602 was reasonable and wrong: it would have put every NPS 1 to 1 1/2 API 600 gate valve out of scope."
    },
    "npsMax": {
     "was": null,
     "now": 42,
     "evidence": "Clause 1 stops at DN 1050 (NPS 42). An open-ended maximum would have accepted an NPS 48 gate valve that API 600 does not cover."
    }
   },
   "pressureClasses": [
    "150",
    "300",
    "600",
    "900",
    "1500",
    "2500"
   ],
   "designFeatures": [
    "BOLTED_BONNET",
    "OUTSIDE_SCREW_AND_YOKE",
    "RISING_STEM",
    "NON_RISING_HANDWHEEL",
    "SINGLE_OR_DOUBLE_GATE",
    "WEDGE_OR_PARALLEL_SEATING",
    "METALLIC_SEATING_SURFACES"
   ],
   "endTypes": [
    "FLANGED",
    "BUTT_WELDING"
   ],
   "verifiedFrom": "API Standard 600, 14th edition, 2021 - clause 1, clause 7.3, Table 8, Table 9 and Table D.1",
   "tablesNotTranscribed": {
    "tables": [
     "Table 1 minimum wall thickness for body and bonnet",
     "Table 2 minimum inside diameter DN 800-1050",
     "Table 3 minimum wear travel and maximum stem projection",
     "Table 4 minimum stem diameter",
     "Tables 5 and 6 nominal radial width of packing",
     "Table 7 materials for parts",
     "Tables D.1 to D.4 body/bonnet/cover material and bolting combinations"
    ],
    "reason": "A readable copy arrived, so Table 8 (trim materials) and Table 9 (alternative trim numbers) are now transcribed into the material library. The tables above are dimensional and bolting data that no consumer asks for yet; they are left until something needs them, not because they cannot be read.",
    "whatWouldFixIt": "Nothing - the copy is readable. These are simply not built yet."
   }
  },
  {
   "code": "API 602",
   "title": {
    "en": "Gate, Globe, and Check Valves for Sizes DN 100 (NPS 4) and Smaller for the Petroleum and Natural Gas Industries",
    "fa": "شیرهای کشویی، کف‌فلزی و یک‌طرفه در اندازه ۱۰۰ میلی‌متر و کمتر"
   },
   "valveTypes": [
    "GATE",
    "GLOBE",
    "CHECK"
   ],
   "bodyGroups": [
    "FORGINGS",
    "CASTINGS"
   ],
   "npsMin": 0.25,
   "npsMax": 4,
   "note": {